{
  "workerId": "template-worker-id",
  "role": "builder",
  "candidateLabel": "candidate-a",
  "packageLabel": null,
  "cycle": null,
  "turnLimit": 1,
  "wallSecondsMaximum": 2400,
  "maxTokens": null,
  "maxTokensUnavailableReason": "required-at-run",
  "environmentSha256": "0000000000000000000000000000000000000000000000000000000000000000",
  "modelConfigSha256": "0000000000000000000000000000000000000000000000000000000000000000",
  "modelConfigUnavailableReason": null,
  "startedAt": "2026-07-20T00:00:00Z",
  "completedAt": "2026-07-20T00:00:00Z",
  "wallSeconds": 0,
  "totalTokens": null,
  "usd": null,
  "source": "unavailable"
}
